{"receiptId":"reconciliation","runId":"run","taskId":"task","taskRevision":1,"leaseGeneration":1,"operationFingerprint":"aaaaaaaaaaaaaaaaaaaaaaaaaaaaaaaaaaaaaaaaaaaaaaaaaaaaaaaaaaaaaaaa","inputTreeHash":"bbbbbbbbbbbbbbbbbbbbbbbbbbbbbbbbbbbbbbbbbbbbbbbbbbbbbbbbbbbbbbbb","evidenceHashes":["cccccccccccccccccccccccccccccccccccccccccccccccccccccccccccccccc"],"resolvedRunState":"abandoned","sideEffectDisposition":"not-started","safeToRetry":true,"provenance":"human-confirmed","actorLabel":"Leo","timestamp":"2099-01-01T00:00:00.000Z","expiresAt":"2099-01-02T00:00:00.000Z"}
